{
  "log_id": "satlog-redacted-hyperscale_island-001",
  "spec_version": "1.0.0",
  "subject_id": "dep-redacted-hyperscale-island-001",
  "events": [
    {
      "event_id": "sat-redacted-fc-string-001",
      "gate_id": "hyperscale_island.fuel_cell_string_ready",
      "occurred_at": "2026-07-20T20:50:00Z",
      "result": "pass",
      "evidence_type": "FuelCellStartInterlocksOk",
      "actor_id": "actor-redacted-field-tech",
      "metrics": {
        "evidence_ref": "ev-redacted-fc-interlocks-001",
        "status": "REDACTED"
      },
      "notes": "Redacted SAT event; raw site identifiers removed."
    },
    {
      "event_id": "sat-redacted-gas-detection-001",
      "gate_id": "hyperscale_island.fuel_cell_string_ready",
      "occurred_at": "2026-07-20T20:50:30Z",
      "result": "pass",
      "evidence_type": "GasDetectionLoopOk",
      "actor_id": "actor-redacted-field-tech",
      "metrics": {
        "evidence_ref": "ev-redacted-gas-detection-loop-001",
        "status": "REDACTED"
      },
      "notes": "Redacted SAT event; raw site identifiers removed."
    },
    {
      "event_id": "sat-redacted-phase-sync-001",
      "gate_id": "hyperscale_island.bess_phase_sync",
      "occurred_at": "2026-07-20T20:51:00Z",
      "result": "pass",
      "evidence_type": "PhaseSyncInTolerance",
      "actor_id": "actor-redacted-field-tech",
      "metrics": {
        "evidence_ref": "ev-redacted-phase-sync-001",
        "status": "REDACTED"
      },
      "notes": "Redacted SAT event; raw site identifiers removed."
    },
    {
      "event_id": "sat-redacted-island-xfer-001",
      "gate_id": "hyperscale_island.island_transfer_drill",
      "occurred_at": "2026-07-20T20:52:00Z",
      "result": "pass",
      "evidence_type": "IslandTransferSequenceOk",
      "actor_id": "actor-redacted-field-tech",
      "metrics": {
        "evidence_ref": "ev-redacted-island-transfer-sequence-001",
        "status": "REDACTED"
      },
      "notes": "Redacted SAT event; raw site identifiers removed."
    },
    {
      "event_id": "sat-redacted-island-voltage-001",
      "gate_id": "hyperscale_island.island_transfer_drill",
      "occurred_at": "2026-07-20T20:52:30Z",
      "result": "pass",
      "evidence_type": "GridVoltageInBand",
      "actor_id": "actor-redacted-field-tech",
      "metrics": {
        "evidence_ref": "ev-redacted-island-voltage-001",
        "status": "REDACTED"
      },
      "notes": "Redacted SAT event; raw site identifiers removed."
    },
    {
      "event_id": "sat-redacted-ups-ridethrough-001",
      "gate_id": "hyperscale_island.ups_ridethrough_review",
      "occurred_at": "2026-07-20T20:53:00Z",
      "result": "pass",
      "evidence_type": "UpsRideThroughDurationMet",
      "actor_id": "actor-redacted-field-tech",
      "metrics": {
        "evidence_ref": "ev-redacted-ups-ridethrough-001",
        "status": "REDACTED"
      },
      "notes": "Redacted SAT event; raw site identifiers removed."
    },
    {
      "event_id": "sat-redacted-resync-return-001",
      "gate_id": "hyperscale_island.resync_return",
      "occurred_at": "2026-07-20T20:54:00Z",
      "result": "pass",
      "evidence_type": "ResyncReturnSequenceOk",
      "actor_id": "actor-redacted-field-tech",
      "metrics": {
        "evidence_ref": "ev-redacted-resync-return-001",
        "status": "REDACTED"
      },
      "notes": "Redacted SAT event; raw site identifiers removed."
    },
    {
      "event_id": "sat-redacted-return-sync-001",
      "gate_id": "hyperscale_island.resync_return",
      "occurred_at": "2026-07-20T20:54:30Z",
      "result": "pass",
      "evidence_type": "PhaseSyncInTolerance",
      "actor_id": "actor-redacted-field-tech",
      "metrics": {
        "evidence_ref": "ev-redacted-return-sync-001",
        "status": "REDACTED"
      },
      "notes": "Redacted SAT event; raw site identifiers removed."
    }
  ]
}
