{
  "log_id": "satlog-redacted-remote_resilient_microgrid-001",
  "spec_version": "1.0.0",
  "subject_id": "dep-redacted-remote-microgrid-001",
  "events": [
    {
      "event_id": "sat-redacted-diesel-baseline-001",
      "gate_id": "remote_resilient_microgrid.diesel_baseline",
      "occurred_at": "2026-07-20T20:50:00Z",
      "result": "pass",
      "evidence_type": "InspectionPass",
      "actor_id": "actor-redacted-field-tech",
      "metrics": {
        "status": "REDACTED"
      },
      "notes": "Redacted SAT event; raw site identifiers removed."
    },
    {
      "event_id": "sat-redacted-inverter-join-001",
      "gate_id": "remote_resilient_microgrid.cots_inverter_join",
      "occurred_at": "2026-07-20T20:51:00Z",
      "result": "pass",
      "evidence_type": "AntiIslandingOk",
      "actor_id": "actor-redacted-field-tech",
      "metrics": {
        "status": "REDACTED"
      },
      "notes": "Redacted SAT event; raw site identifiers removed."
    },
    {
      "event_id": "sat-redacted-ddil-001",
      "gate_id": "remote_resilient_microgrid.ddil_drill",
      "occurred_at": "2026-07-20T20:52:00Z",
      "result": "pass",
      "evidence_type": "InspectionPass",
      "actor_id": "actor-redacted-field-tech",
      "metrics": {
        "status": "REDACTED"
      },
      "notes": "Redacted SAT event; raw site identifiers removed."
    }
  ]
}
